status_code,status_group,meaning_en,meaning_zh,can_support_source_existence,can_support_payload_extracted,allowed_project_use,caution_en,caution_zh,review_status,updated_at
downloaded,successful_payload,The source payload was downloaded and saved under an ignored temporary path; checksum and size are logged.,来源内容已下载并保存到被忽略的临时路径；日志记录校验和与大小。,true,true,Use as checksum-backed access evidence and extract reviewed metadata only.,Downloaded payload still needs rights and content review before raw material is committed.,已下载内容在提交原始材料前仍需权利和内容复核。,reviewed,2026-06-05
downloaded_access_restricted_page,access_boundary,The server returned an HTML access-restricted page; this proves endpoint reachability and access boundary only.,服务器返回访问限制 HTML 页面；只证明端点可达和访问边界。,true,false,Use as access-boundary evidence; use browser-verified or manual-exported metadata for source facts.,Do not infer hidden database rows from an access-restricted page.,不得从访问限制页推断隐藏数据库行。,reviewed,2026-06-05
downloaded_client_challenge_page,access_boundary,The server returned a browser/client challenge page; this proves endpoint reachability and automation boundary only.,服务器返回浏览器或客户端挑战页面；只证明端点可达和自动化边界。,true,false,Use as access-boundary evidence; retry only with documented controlled browsing if needed.,Do not bypass technical protections or treat the challenge page as source content.,不得绕过技术保护，也不得把挑战页当作来源正文。,reviewed,2026-06-05
download_error,access_boundary,"The downloader failed before receiving a usable payload; the error message may document TLS, DNS, timeout, or connection boundaries.",下载器在取得可用内容前失败；错误信息可记录 TLS、DNS、超时或连接边界。,false,false,Use as a logged access-risk note and keep separately reviewed source metadata if available.,Do not treat download_error as proof that the page content was captured.,不得把 download_error 当作页面内容已采集的证明。,reviewed,2026-06-05
http_error,access_boundary,The server returned an HTTP error code; status code and reason document access failure.,服务器返回 HTTP 错误码；状态码和原因记录访问失败。,false,false,Use as access-risk evidence and revisit only when the source remains important.,Do not extract source claims from an HTTP error response unless the body is separately reviewed.,除非单独复核响应正文，否则不得从 HTTP 错误响应提取来源断言。,reviewed,2026-06-05
skipped_exceeds_manifest_limit,size_boundary,The payload exceeded the manifest max_bytes limit and was not saved.,内容超过 manifest 的 max_bytes 限制，原始内容未保存。,true,false,Register as size-boundary evidence and create a large-source handling plan before retrying.,"Do not increase limits casually; split, sample, or register the large package first.",不得随意提高限制；应先分包、抽样或登记大型来源包。,reviewed,2026-06-05
